{"$id":"urn:randle:r5:review-issuance","$schema":"https://json-schema.org/draft/2020-12/schema","additionalProperties":false,"properties":{"authority_id":{"const":"R5-REVIEW-ISSUANCE-AUTHORITY"},"authorized_receipt":{"additionalProperties":false,"properties":{"accepted_specification_identity":{"const":"be59cd97e8a0333298a44af889a35762458b6b336b254f892e39bcbf23c7d76e"},"authorization_boundaries":{"items":false,"maxItems":3,"minItems":3,"prefixItems":[{"const":"NO_CAPTURE"},{"const":"NO_DEPLOYMENT"},{"const":"NO_TRADING"}],"type":"array"},"compatibility_identity":{"const":"4365c98ace277771c1a308d842ad53755ac3f89ad4b035e1b7b60cbd5180b25e"},"decision":{"const":"ACCEPT"},"independence_proof":{"const":"NO_PACKAGE_AUTHOR_RELATIONSHIP"},"issuance_authority_identity":{"const":"R5-REVIEW-ISSUANCE-AUTHORITY"},"issued_timestamp":{"const":"2026-07-22T22:00:00Z"},"manifest_identity":{"const":"8d1afd7170038b80822ad354971e1847c263919fb6e02ea16670bd8f073f3682"},"package_identity":{"const":"1111111111111111111111111111111111111111111111111111111111111111"},"receipt_identity":{"const":"cccccccccccccccccccccccccccccccccccccccccccccccccccccccccccccccc"},"reviewer_authority":{"const":"R5-REVIEWER-TRUST-ROOT"},"reviewer_identity":{"const":"independent-r5-reviewer-fixture"},"reviewer_persona":{"const":"INDEPENDENT_GOVERNANCE_REVIEWER"},"schema_version":{"const":"7.0.0-DRAFT"},"script_identity":{"const":"5555555555555555555555555555555555555555555555555555555555555555"},"trust_root_identity":{"const":"b4a9b08fdfb76c8b7f6445656fdeece35389b8d1d3f75894a7008fc885bdc15d"}},"required":["schema_version","reviewer_identity","reviewer_persona","reviewer_authority","independence_proof","decision","issued_timestamp","package_identity","manifest_identity","script_identity","accepted_specification_identity","compatibility_identity","authorization_boundaries","trust_root_identity","issuance_authority_identity","receipt_identity"],"type":"object"},"issuer_capability":{"const":"ISSUE_REVIEW_RECEIPT"},"schema_version":{"const":"7.0.0-DRAFT"},"trusted_issuer":{"const":"R5-REVIEW-TRUST-ISSUER"}},"required":["schema_version","authority_id","trusted_issuer","issuer_capability","authorized_receipt"],"type":"object"}
