{"authority_id":"R5-REVIEW-ISSUANCE-AUTHORITY","authorized_receipt":{"accepted_specification_identity":"be59cd97e8a0333298a44af889a35762458b6b336b254f892e39bcbf23c7d76e","authorization_boundaries":["NO_CAPTURE","NO_DEPLOYMENT","NO_TRADING"],"compatibility_identity":"4365c98ace277771c1a308d842ad53755ac3f89ad4b035e1b7b60cbd5180b25e","decision":"ACCEPT","independence_proof":"NO_PACKAGE_AUTHOR_RELATIONSHIP","issuance_authority_identity":"R5-REVIEW-ISSUANCE-AUTHORITY","issued_timestamp":"2026-07-22T22:00:00Z","manifest_identity":"8d1afd7170038b80822ad354971e1847c263919fb6e02ea16670bd8f073f3682","package_identity":"1111111111111111111111111111111111111111111111111111111111111111","receipt_identity":"cccccccccccccccccccccccccccccccccccccccccccccccccccccccccccccccc","reviewer_authority":"R5-REVIEWER-TRUST-ROOT","reviewer_identity":"independent-r5-reviewer-fixture","reviewer_persona":"INDEPENDENT_GOVERNANCE_REVIEWER","schema_version":"7.0.0-DRAFT","script_identity":"5555555555555555555555555555555555555555555555555555555555555555","trust_root_identity":"b4a9b08fdfb76c8b7f6445656fdeece35389b8d1d3f75894a7008fc885bdc15d"},"issuer_capability":"ISSUE_REVIEW_RECEIPT","schema_version":"7.0.0-DRAFT","trusted_issuer":"R5-REVIEW-TRUST-ISSUER"}
